{
  "$schema": "https://json-schema.org/draft/2020-12/schema",
  "$id": "https://flux-eco.fluxlabs.ch/schemas/medi-course-management-frontend-config-schema.json",
  "title": "FluxEcoLearnplacesFrontendConfigSchema",
  "allOf": [
    {
      "$ref": "../../../flux-eco/schemas/flux-eco-app-config-schema.json"
    }
  ],
  "type": "object",
  "properties": {
    "name": {
      "type": "string",
      "const": "medi-course-management-frontend"
    },
    "inboundsConfig": {
      "httpBindingConfig": {
        "$ref": "../../../flux-eco/schemas/binding-schemas/http-schemas/flux-eco-http-binding-config-schema.json"
      }
    },
    "apiConfig": {
      "$ref": "medi-course-management-frontend-api-config-schema.json"
    },
    "outboundsConfigs": {
      "type": "object",
      "properties": {
        "proxyRequestHandler": {
          "$ref": "../../../flux-eco-http-proxy-request/app/schema/flux-eco-http-proxy-request-config-schema.json"
        }
      },
      "required": [
        "proxyRequestHandler"
      ]
    }
  }
}